<!ELEMENT matricula (personal, pago)>
<!ELEMENT personal (dni, nombre, titulacion, curso_academico, domicilios)>
<!ELEMENT dni (#PCDATA)>
<!ELEMENT nombre (#PCDATA)>
<!ELEMENT titulacion (#PCDATA)>
<!ELEMENT curso_academico (#PCDATA)>
<!ELEMENT domicilios (domicilio+)>
<!ELEMENT domicilio (calle, numero, ciudad)>
<!ATTLIST domicilio tipo (familiar|habitual) #REQUIRED>
<!ELEMENT calle (#PCDATA)>
<!ELEMENT numero (#PCDATA)>
<!ELEMENT ciudad (#PCDATA)>
<!ELEMENT pago (tipo_matricula)>
<!ELEMENT tipo_matricula (#PCDATA)>
